{
  "created_at": "2026-09-27T09:30:00Z",
  "grouping_method": "keyed_pseudonymous_collection_group",
  "privacy_note": "Collection paths are represented only by keyed opaque group IDs.",
  "records": [
    {
      "flight_id": "flight-151",
      "group_id": "grp-294db570908238b7e557",
      "sha256": "9a0a54c0e91d949c81e5178e273ff418ce9801fcede1a4a40bd67135e519883b"
    },
    {
      "flight_id": "flight-152",
      "group_id": "grp-44852511260b2cbd9e4f",
      "sha256": "9a25ae09acf4edd19626a51b8fed458d3bfe9bace57c5ab42a9ad2b3a54d97c9"
    },
    {
      "flight_id": "flight-153",
      "group_id": "grp-f1c20a19c5eedae5726e",
      "sha256": "861a25c8af1c091d08ad4e5b8994aeb212924cdf15499737a6c721d64edc2c07"
    },
    {
      "flight_id": "flight-154",
      "group_id": "grp-eb1e99c15632b64129a0",
      "sha256": "bc84ab816e41821ed5056b1caff4fff73571b0493893058dcbbbd0479025b70d"
    },
    {
      "flight_id": "flight-155",
      "group_id": "grp-7ddc550756188bae129f",
      "sha256": "c93a6cdf9279d9ef1314f39deff341ad53c2f5ebb895ecf538a707af9cf6bda5"
    }
  ],
  "schema_version": "1.0.0",
  "source_id": "uav-sead",
  "source_version": "774a336a1d1d06b248927a35c2ea1f6869e9e1a4"
}
