{
  "created_at": "2026-09-27T04:10:00Z",
  "grouping_method": "keyed_pseudonymous_collection_group",
  "privacy_note": "Collection paths are represented only by keyed opaque group IDs.",
  "records": [
    {
      "flight_id": "flight-051",
      "group_id": "grp-8e718724a435d313a12e",
      "sha256": "a6b8cdc3caa1d00bcd279838a291f764f26bb81d74d45076692d21520096f10f"
    },
    {
      "flight_id": "flight-052",
      "group_id": "grp-fa733bbc7a00571ca3bb",
      "sha256": "35513dbe11e3b126ca8c03e88fcc31eda95a4e2078b0f727b82d083ab0dc2be9"
    },
    {
      "flight_id": "flight-053",
      "group_id": "grp-1256ad6be42749a1be4d",
      "sha256": "1bb57bbb686201ab7cb6bf1b9548a25a153a1df137c6a0734bb315122f046ba0"
    },
    {
      "flight_id": "flight-054",
      "group_id": "grp-421f7f96cefdee445b36",
      "sha256": "ef4d2519a497eb9d22b8ed4faf801996bbf78c874f68ee520733f5dee280eb41"
    },
    {
      "flight_id": "flight-055",
      "group_id": "grp-fe76cd57eb209f2e4296",
      "sha256": "521da8cb8f4adc6155ca4ceef0d92177ae235d0579681d06ff00d7bc8a0b7901"
    }
  ],
  "schema_version": "1.0.0",
  "source_id": "uav-sead",
  "source_version": "774a336a1d1d06b248927a35c2ea1f6869e9e1a4"
}
