{
  "created_at": "2026-09-27T05:15:00Z",
  "grouping_method": "keyed_pseudonymous_collection_group",
  "privacy_note": "Collection paths are represented only by keyed opaque group IDs.",
  "records": [
    {
      "flight_id": "flight-076",
      "group_id": "grp-d0faf2e71cadf528392e",
      "sha256": "45333aaa6f451b6d56418c56eb36bbc519a3fd33d38954804cb867e0c1d510e4"
    },
    {
      "flight_id": "flight-077",
      "group_id": "grp-e630b28355925c23a417",
      "sha256": "ac8248d1da279028d26b1397d1fd958e372795f55648d28a4a6828837b756286"
    },
    {
      "flight_id": "flight-078",
      "group_id": "grp-a100547e1dcd4c9b26d0",
      "sha256": "5d8a92741ea8786cf27cb768a23eb6442c0cec767f475413a3a8d8e4ed6b822b"
    },
    {
      "flight_id": "flight-079",
      "group_id": "grp-4b84a952f0b51e08c169",
      "sha256": "29347a7bafd018e0ab1ffa93b85ed1e0f4805234d3152dfd488b2e0ddf09bafd"
    },
    {
      "flight_id": "flight-080",
      "group_id": "grp-4f59d0c653437630175e",
      "sha256": "91d4e550d986abcc7c63a897e22f7248022704ef35ce29250a8f9ea2cfdabe3e"
    }
  ],
  "schema_version": "1.0.0",
  "source_id": "uav-sead",
  "source_version": "774a336a1d1d06b248927a35c2ea1f6869e9e1a4"
}
