{
  "created_at": "2026-09-27T11:34:00Z",
  "grouping_method": "keyed_pseudonymous_collection_group",
  "privacy_note": "Collection paths are represented only by keyed opaque group IDs.",
  "records": [
    {
      "flight_id": "flight-171",
      "group_id": "grp-6fa87fc1dba9be707e00",
      "sha256": "edfed22bf2b7dd0e4cb6ea3a092c41cdf111c46dd49462b08baaf54b2be42c2f"
    },
    {
      "flight_id": "flight-172",
      "group_id": "grp-6fa87fc1dba9be707e00",
      "sha256": "465f99a88f6f681fa4bfda2a917e94fa78fc96306fceb525b72a29cafed99baf"
    },
    {
      "flight_id": "flight-173",
      "group_id": "grp-6fa87fc1dba9be707e00",
      "sha256": "e785a813c476125caa0d2017579118bb2b741b905b3b1bc415843c3c2930abe0"
    },
    {
      "flight_id": "flight-174",
      "group_id": "grp-23e4eb56da6254e7c8a8",
      "sha256": "d81f29c7b1b5b2caa9f2c4badf8c8d05df83eb33dba8dea3832d4cebca3c6ae1"
    },
    {
      "flight_id": "flight-175",
      "group_id": "grp-737bd12207b94cfdb53f",
      "sha256": "43dd45a103a22fcf7f7de96470d781211779c31bfb13da1fd736522eac0b1c67"
    }
  ],
  "schema_version": "1.0.0",
  "source_id": "uav-sead",
  "source_version": "774a336a1d1d06b248927a35c2ea1f6869e9e1a4"
}
