{
  "created_at": "2026-09-27T06:23:00Z",
  "grouping_method": "keyed_pseudonymous_collection_group",
  "privacy_note": "Collection paths are represented only by keyed opaque group IDs.",
  "records": [
    {
      "flight_id": "flight-116",
      "group_id": "grp-95f829aa1e7cb963eb3f",
      "sha256": "e996d8db8f47d34b50dded6e4564954f83e47e3a7b5de86dfac96d51999d444e"
    },
    {
      "flight_id": "flight-117",
      "group_id": "grp-e1e3a41bdfee0f2c895e",
      "sha256": "83c928aa9112998160e6be94ec8831c4e9c265fe3e8ddb9920e1564ea0748bf4"
    },
    {
      "flight_id": "flight-118",
      "group_id": "grp-05122ccb052e1fea2b12",
      "sha256": "1d52691943cebd26506f8700346e042f0068ce7ba6f3a627520d257de3a60f7b"
    },
    {
      "flight_id": "flight-119",
      "group_id": "grp-0143edccdf1791031248",
      "sha256": "d6f858d54b6db7167c3bd1301edd5c8ebe6b4d05f712953c60fa068557b00600"
    },
    {
      "flight_id": "flight-120",
      "group_id": "grp-80eae769b34918b75ab5",
      "sha256": "1cda93e55fe7aaf6f55827ceeb0a8dac038aa948c4af9057627e483d6341c4ed"
    }
  ],
  "schema_version": "1.0.0",
  "source_id": "uav-sead",
  "source_version": "774a336a1d1d06b248927a35c2ea1f6869e9e1a4"
}
