{
  "created_at": "2026-09-26T00:20:00Z",
  "grouping_method": "keyed_pseudonymous_collection_group",
  "privacy_note": "Collection paths are represented only by keyed opaque group IDs.",
  "records": [
    {
      "flight_id": "flight-006",
      "group_id": "grp-5f01ce86a6197cd105ec",
      "sha256": "cbe844319e7bb26a790b3d591d146e25a94fe83893ce758a52ce0185e9ea15e2"
    },
    {
      "flight_id": "flight-007",
      "group_id": "grp-538c58c426cc44364380",
      "sha256": "d10ddb571acf61d790b5ac0f4301c17c5a827f5f8858eb016c9f4903f105b677"
    },
    {
      "flight_id": "flight-008",
      "group_id": "grp-6fa87fc1dba9be707e00",
      "sha256": "cdadf077d09c65e939207eb26be0baf16522a10b7fce58be57d3fb41c89d1109"
    },
    {
      "flight_id": "flight-009",
      "group_id": "grp-a335817f6fd24930babc",
      "sha256": "c731cdec25ba505a7b4ff59c411095ccbb49ec8f6f74ccebc29f27497ba13d94"
    },
    {
      "flight_id": "flight-010",
      "group_id": "grp-36370fc12d532c4b43fb",
      "sha256": "c97e59d669f41deb05bde2c3264411de00ba9b6a9b6fd26a0a38d09564e17ffa"
    }
  ],
  "schema_version": "1.0.0",
  "source_id": "uav-sead",
  "source_version": "774a336a1d1d06b248927a35c2ea1f6869e9e1a4"
}
