{
  "created_at": "2026-09-27T03:06:00Z",
  "grouping_method": "keyed_pseudonymous_collection_group",
  "privacy_note": "Collection paths are represented only by keyed opaque group IDs.",
  "records": [
    {
      "flight_id": "flight-031",
      "group_id": "grp-90df016ef6c347f8a95a",
      "sha256": "404b317045e76c0b50cffa3076f6e8c9f9bde5623cbb90fc0e626e2d50997d73"
    },
    {
      "flight_id": "flight-032",
      "group_id": "grp-775406e491229e050f9d",
      "sha256": "6e90910e466663288fddb0fa7f48a1c5be145018652565fc4a986f37e6b888a3"
    },
    {
      "flight_id": "flight-033",
      "group_id": "grp-e920f7900188601f12cd",
      "sha256": "342053b82aefb8b0ee518c3c6feb17504912f560c778832448b5f9397fc21da4"
    },
    {
      "flight_id": "flight-034",
      "group_id": "grp-55251b3f59b8807dc5e9",
      "sha256": "954a04d55f8adcce4efda75534a724454359cff5ed00f6a65c7f8f67785077e7"
    },
    {
      "flight_id": "flight-035",
      "group_id": "grp-0bd12b5b6c7a32808e47",
      "sha256": "6b7158828142800e4e3a4735c420ccab76d5a38184f3e1c4743a24208771365c"
    }
  ],
  "schema_version": "1.0.0",
  "source_id": "uav-sead",
  "source_version": "774a336a1d1d06b248927a35c2ea1f6869e9e1a4"
}
